[
  {"site_id": "teesta", "name": "Teesta — South Lhonak GLOF to Teesta III", "status": "ready", "status_reason_key": null, "emulator_ready": true, "models_available": ["delft3d", "sph"], "last_trained_at": "2026-09-24T10:15:00Z", "recheck": {"frequency_days": 90, "last_checked_at": "2026-09-24T10:15:00Z", "next_check_at": "2026-12-23T10:15:00Z"}, "bbox_lonlat": [88.0, 27.5, 89.0, 28.2], "events": ["teesta_2023"], "has_placeholders": true},
  {"site_id": "rishi_ganga", "name": "Rishi Ganga — Raunthi Gad landslide lake", "status": "outdated", "status_reason_key": "outdated_config_changed", "emulator_ready": true, "models_available": ["delft3d"], "last_trained_at": "2026-06-02T09:00:00Z", "recheck": {"frequency_days": 90, "last_checked_at": "2026-06-02T09:00:00Z", "next_check_at": "2026-08-31T09:00:00Z"}, "bbox_lonlat": [79.6, 30.4, 79.9, 30.7], "events": ["chamoli_2021"], "has_placeholders": true},
  {"site_id": "demo_valley", "name": "Demo Valley (synthetic)", "status": "demo_mode", "status_reason_key": null, "emulator_ready": true, "models_available": ["delft3d"], "last_trained_at": "2026-05-10T00:00:00Z", "recheck": {"frequency_days": 90, "last_checked_at": "2026-05-10T00:00:00Z", "next_check_at": "2026-08-08T00:00:00Z"}, "bbox_lonlat": [85.0, 27.0, 85.3, 27.3], "events": [], "has_placeholders": false},
  {"site_id": "synth_engdam", "name": "Synthetic Engineered Dam (test fixture)", "status": "onboarding", "status_reason_key": null, "emulator_ready": false, "models_available": [], "last_trained_at": null, "recheck": {"frequency_days": 90, "last_checked_at": null, "next_check_at": null}, "bbox_lonlat": [80.0, 26.0, 80.3, 26.3], "events": ["synth_event_2020"], "has_placeholders": true}
]
